Ticket Description,Ticket Priority,Ticket Channel,Urgency,Resolution_Time_Bin,Urgency_from_Text,Coincide
digital unable find option perform desire action could guide step,Critical,Chat,1,0,0,False
forgotten password account password reset option work recover account way reset password back account follow online tutorial community forums troubleshoot luck far,High,Social media,1,0,0,False
encounter software bug whenever try perform specific action application crash update fix available avoid outcome problem start occur recent software update havent make change device,Medium,Email,0,0,1,False
productpurchased command may necessary retrieve product code include name image search productp already contact customer support multiple time remain unresolved,Critical,Phone,1,0,0,False
purchase make store also local area must contact seller sale end hour already contact customer support multiple time remain unresolved,High,Chat,1,0,0,False
resold original price website must purchase customer notice sudden decrease battery life use last much long,Critical,Phone,1,0,0,False
seem hardware problem screen flicker unable use try troubleshoot step mention user manual persists,Low,Phone,0,0,1,False
unable access account keep display invalid credential error even though use correct login information regain access account user sure specific device others report similar problem,High,Social media,1,0,0,False
recently set fails connect available network step take troubleshoot phone go start app asks password login experience multiple device model seem widespread problem,High,Phone,1,0,0,False
crash lose data store way recover lose data possible one recover lose data new file notice sudden decrease battery life use last much long,Low,Social media,0,0,1,False
check software update already run late version,High,Email,1,0,0,False
unable access account keep display invalid credential error even though use correct login information regain access account need ance soon possible affect work productivity,Critical,Phone,1,0,0,False
eye pack sell color recently update firmware start happen afterward could relate update,High,Phone,1,0,0,False
face s log account say account lock unlock locked report security s account problem start occur recent software update havent make change device,Critical,Social media,1,0,0,False
recently set fails connect available network step take troubleshoot youre run ubuntu lts configure sure specific device others report similar problem,Critical,Email,1,0,0,False
seem glitch software freeze frequently make difficult use provide solution advance check device setting make sure everything configure correctly,High,Email,1,0,0,False
way official website dont hesitate contact happen problem start occur recent software update havent make change device,Critical,Social media,1,0,0,False
product purchase match display display advise check product product option dashboard detail check available software update none,High,Chat,1,0,0,False
work well still get product request still sale go tried use different cable adapter peripheral persists,High,Chat,1,0,0,False
notice software bug app cause data loss unexpected error resolve select package wish access within app notice occur consistently use specific feature application,Medium,Phone,0,0,1,False
wallet already process error occur twice error reced client mac address mac address use problem start occur recent software update havent make change device,Medium,Social media,0,0,1,False
unable establish stable internet connection keep disconnect intermittently troubleshoot network problem currently network rely heavily daily task hinder productivity,Critical,Social media,1,0,0,False
seller fault know whats ask currently work plan review troubleshoot step official support website didnt resolve problem,High,Phone,1,0,0,False
need rece confirmation send email order message available email review troubleshoot step official support website didnt resolve problem,Critical,Email,1,0,0,False
andor disable app dont send third party seller worry might hardwarerelated might require repair replacement,Critical,Email,1,0,0,False
try make timely manner must soon find inventory continue check advance try use different cable adapter peripheral persists,Critical,Chat,1,0,0,False
contact ill tell dont know contact third unable find option perform desire action could guide step,Critical,Chat,1,0,0,False
notice software bug app cause data loss unexpected error resolve feature available visual facing intermittent sometimes work fine time act unexpectedly,Low,Chat,0,0,1,False
seem glitch software freeze frequently make difficult use provide solution appreciate always let need ance soon possible affect work productivity,High,Chat,1,0,0,False
purchase can not delred recently update firmware start happen afterward could relate update,High,Social media,1,0,0,False
seem hardware problem screen flicker unable use hardware s like screen easy problem start occur recent software update havent make change device,Low,Phone,0,0,1,False
would like request advice contact founder ceo check software update already run late version,High,Chat,1,0,0,False
trouble connect home wifi network doesnt detect network although device connect fine do resolve use recently update firmware start happen afterward could relate update,Critical,Phone,1,0,0,False
reced statement product defect contact manufacturer gladly replace vote print problem start occur recent software update havent make change device,High,Phone,1,0,0,False
list item make japan visit face intermittent sometimes work fine time act unexpectedly,High,Chat,1,0,0,False
apologize see order email next tuesday time update ill update tried use different cable adapter peripheral persists,Critical,Chat,1,0,0,False
product can not obtain let know update name address try use different cable adapter peripheral persists,High,Social media,1,0,0,False
send support addon must accept code checkout credit card purchase account experience multiple device model seem widespread problem,High,Email,1,0,0,False
remy think youre playing try use different cable adapter peripheral persists,Critical,Phone,1,0,0,False
item may backordered within day purchase item fulfil week item place return check device setting make sure everything configure correctly,High,Chat,1,0,0,False
forgotten password account password reset option work recover account download install follow package follow link problem start occur recent software update havent make change device,Low,Email,0,0,1,False
make follow change site make clear customer ask name remove must get refund within unable find option perform desire action could guide step,High,Phone,1,0,0,False
unable establish stable internet connection keep disconnect intermittently troubleshoot network problem work correctly possible may also want change already contact customer support multiple time remain unresolved,Critical,Phone,1,0,0,False
approve user log account feature follow online tutorial community forums troubleshoot luck far,High,Social media,1,0,0,False
productpurchased set problem start occur recent software update havent make change device,High,Phone,1,0,0,False
rece direct message say reced confirmation message refund refund make immediately send face intermittent sometimes work fine time act unexpectedly,High,Chat,1,0,0,False
notice peculiar error message pop screen say mean,High,Email,1,0,0,False
need package must appear start url product want obtain unable find option perform desire action could guide step,Critical,Social media,1,0,0,False
forgotten password account password reset option work recover account say recovery get back site facing intermittent sometimes work fine time act unexpectedly,Critical,Email,1,0,0,False
make strange noise function properly suspect might hardware experience let know technical sure specific device others report similar problem,Critical,Phone,1,0,0,False
also see concerned security would like ensure data safe,Critical,Email,1,0,0,False
forum general topic improve thread use something else simply ask checked device setting make sure everything configure correctly,High,Email,1,0,0,False
encounter software bug whenever try perform specific action application crash update fix available yes update many case software perform factory reset hop would resolve problem didnt,Medium,Chat,0,0,1,False
param database query function function sure specific device others report similar problem,Critical,Email,1,0,0,False
get refund company buying request noticed occurs consistently use specific feature application,Critical,Phone,1,0,0,False
accidentally delete important data way recover delete file need urgently follow troubleshoot step mention user manual persists,High,Phone,1,0,0,False
there much good stuff chance check guy awhile follow online tutorial community forums troubleshoot luck far,Critical,Phone,1,0,0,False
bug system cant way brand work get broken product repair follow online tutorial community forums troubleshoot luck far,Critical,Social media,1,0,0,False
already contact customer support multiple time remain unresolved,High,Social media,1,0,0,False
problem inform already contact customer support multiple time remain unresolved,High,Social media,1,0,0,False
section describe functionality method use product request object facing intermittent sometimes work fine time act unexpectedly,Critical,Social media,1,0,0,False
enable javascript view comment power disqus disqus problem start occur recent software update havent make change device,High,Chat,1,0,0,False
face s log account say account lock unlock log account perform factory reset hop would resolve problem didnt,High,Phone,1,0,0,False
try clear cache data app persists,Critical,Chat,1,0,0,False
sure specific device others report similar problem,High,Chat,1,0,0,False
accidentally delete important data way recover delete file need urgently accidentally delete important data review troubleshoot step official support website didnt resolve problem,High,Social media,1,0,0,False
recently set fails connect available network step take troubleshoot youll find problem start set configuration try troubleshoot step mention user manual persists,High,Chat,1,0,0,False
face problem turn work fine yesterday doesnt respond want know face intermittent sometimes work fine time act unexpectedly,High,Email,1,0,0,False
crash lose data store way recover lose data cant get user stop use app two request recently update firmware start happen afterward could relate update,Low,Email,0,0,1,False
problem sort concern security would like ensure data safe,High,Social media,1,0,0,False
true price exact price pay may change one list follow troubleshoot step mention user manual persists,Critical,Chat,1,0,0,False
never one didnt come package verified purchase yes condition try clear cache data app persists,Critical,Email,1,0,0,False
make strange noise function properly suspect might hardware followed online tutorial community forums troubleshoot luck far,Critical,Chat,1,0,0,False
unable establish stable internet connection keep disconnect intermittently troubleshoot network problem troubleshoot network problem use follow option unable find option perform desire action could guide step,High,Email,1,0,0,False
problem need contact soon customer service product service customer service notice peculiar error message pop screen say mean,High,Phone,1,0,0,False
forgotten password account password reset option work recover account account register want contact notice peculiar error message pop screen say mean,Critical,Social media,1,0,0,False
forgotten password account password reset option work recover account face intermittent sometimes work fine time act unexpectedly,Critical,Chat,1,0,0,False
recently set fails connect available network step take troubleshoot install java build install upgrade need ance soon possible affect work productivity,High,Email,1,0,0,False
productid much charge business use original charger come charge properly,Critical,Social media,1,0,0,False
forgotten password account password reset option work recover account recover google account youve take online search google app sure specific device others report similar problem,High,Chat,1,0,0,False
seem glitch software freeze frequently make difficult use provide solution user info alpus alpus notice sudden decrease battery life use last much long,Critical,Social media,1,0,0,False
crash lose data store way recover lose data recently update firmware start happen afterward could relate update,Critical,Email,1,0,0,False
reason hard get product one see product claim want recently update firmware start happen afterward could relate update,Critical,Phone,1,0,0,False
people solve donate via paypal may get new username sure specific device others report similar problem,Critical,Chat,1,0,0,False
accidentally delete important data way recover delete file need urgently must send updated vendor recovery face intermittent sometimes work fine time act unexpectedly,High,Social media,1,0,0,False
error processing request try one browser tab open base quantity select unable check available software update none,Critical,Email,1,0,0,False
ecommerce server run microsoft azure instance run window azure server might experience youll need rely heavily daily task hinder productivity,Critical,Chat,1,0,0,False
seem glitch software freeze frequently make difficult use provide solution default setting game make fall may unable find option perform desire action could guide step,Low,Chat,0,0,1,False
forgotten password account password reset option work recover account recover full password contact company service purchase product notice occurs consistently use specific feature application,Critical,Chat,1,0,0,False
unable establish stable internet connection keep disconnect intermittently troubleshoot network problem can not connect either external unable find option perform desire action could guide step,Critical,Phone,1,0,0,False
use include product purchase purchase try use different cable adapter peripheral persists,High,Email,1,1,0,False
encounter data loss file document seem disappear guide retrieve also get manually copy file check device setting make sure everything configure correctly,High,Chat,1,0,0,False
spokesperson say press release post friday also follow online tutorial community forums troubleshoot luck far,Critical,Social media,1,0,0,False
notice software bug app cause data loss unexpected error resolve log security system never affect attack notice sudden decrease battery life use last much long,Low,Email,0,0,1,False
fix fix typo already contact customer support multiple time remain unresolved,High,Phone,1,0,0,False
encounter software bug whenever try perform specific action application crash update fix available connect server root try clear cache data app persists,Low,Chat,0,0,1,False
review troubleshoot step official support website didnt resolve problem,Critical,Chat,1,0,0,False
product compatible option may cancel time may work system tried use different cable adapter peripheral persists,Critical,Chat,1,0,0,False
make strange noise function properly suspect might hardware friend game concerned security would like ensure data safe,High,Email,1,0,0,False
information provide last week young artist wear long perform factory reset hop would resolve problem didnt,High,Email,1,0,0,False
face s log account say account lock unlock look custom login name enter code concerned security would like ensure data safe,High,Email,1,0,0,False
contact customer service department email protect well work hard make product available discount order ship via usps priority need ance soon possible affect work productivity,High,Social media,1,0,0,False
face problem turn work fine yesterday doesnt respond screen keep load recently update firmware start happen afterward could relate update,Critical,Social media,1,0,0,False
emote keymonkey bthe monkey problem start occur recent software update havent make change device,High,Chat,1,1,0,False
order location wrong let know check software update already run late version,Critical,Email,1,0,0,False
patch fix retrieve product purchase etsy fix product list inventory unable find option perform desire action could guide step,High,Email,1,0,0,False
crash lose data store way recover lose data log could find data retrieve review troubleshoot step official support website didnt resolve problem,Low,Phone,0,0,1,False
seem hardware problem screen flicker unable use g manufacturer check device setting make sure everything configure correctly,Medium,Social media,0,0,1,False
price reflect price pay purchased product purchase make seller refund delry order try different setting configuration persists,Critical,Phone,1,0,0,False
already contact customer support multiple time remain unresolved,High,Email,1,0,0,False
ingredient item add back feedback happy shop see shelve another problem start occur recent software update havent make change device,Critical,Phone,1,1,0,False
question send email information product sell recently update firmware start happen afterward could relate update,High,Email,1,0,0,False
unable access account keep display invalid credential error even though use correct login information regain access account change notice occurs consistently use specific feature application,Critical,Phone,1,0,0,False
first order ship japan allow bit time shipment well ship worried might hardwarerelated might require repair replacement,Critical,Chat,1,0,0,False
encounter data loss file document seem disappear guide retrieve update name daniel experience multiple device model seem widespread problem,High,Social media,1,0,0,False
userproductname etsy want connect etsy provide recently update firmware start happen afterward could relate update,Critical,Email,1,0,0,False
notice software bug app cause data loss unexpected error resolve download create verify data windows phone open problem start occur recent software update havent make change device,Low,Phone,0,0,1,False
tried work great make whole sale recently update firmware start happen afterward could relate update,Critical,Phone,1,0,0,False
warranty life limit recommend return exchange product product sure specific device others report similar problem,Critical,Chat,1,0,0,False
others best make great gift feel like need effort something special facing intermittent sometimes work fine time act unexpectedly,Critical,Phone,1,0,0,False
get message say okay ask stop buying here thing make item worth much money concern security would like ensure data safe,Critical,Email,1,0,0,False
recently set fails connect available network step take troubleshoot update order properly verify network connection fails need ance soon possible affect work productivity,High,Social media,1,1,0,False
someone come location dont concerned security would like ensure data safe,Critical,Phone,1,0,0,False
forgotten password account password reset option work recover account yes log reset account usual concerned security would like ensure data safe,High,Email,1,0,0,False
item currently sale may move contact see available sale need ance soon possible affect work productivity,High,Phone,1,0,0,False
rely heavily daily task hinder productivity,Critical,Email,1,0,0,False
forgotten password account password reset option work recover account recover check available software update none,Critical,Email,1,0,0,False
server threadwarn item remove game may remove follow troubleshoot step mention user manual persists,Critical,Phone,1,0,0,False
place place bad price staff notice peculiar error message pop screen say mean,Critical,Social media,1,0,0,False
click item title click order button shopping shop click seller page recently update firmware start happen afterward could relate update,Critical,Email,1,1,0,False
follow link longer work need ance soon possible affect work productivity,High,Social media,1,0,0,False
name daniel miller name daniel miller face red three daughter name huge concerned security would like ensure data safe,Critical,Email,1,0,0,False
notice software bug app cause data loss unexpected error resolve step unlock phone window worry might hardwarerelated might require repair replacement,Low,Social media,0,0,1,False
unable establish stable internet connection keep disconnect intermittently troubleshoot network problem solve condition select network page browser menu worried might hardwarerelated might require repair replacement,Critical,Chat,1,0,0,False
seem hardware problem screen flicker unable use fix use follow command terminal checked device setting make sure everything configure correctly,Medium,Social media,0,0,1,False
unable access account keep display invalid credential error even though use correct login information regain access account use problem start occur recent software update havent make change device,Low,Email,0,0,1,False
seem glitch software freeze frequently make difficult use provide solution staff drop identify follow troubleshoot step mention user manual persists,Critical,Chat,1,0,0,False
make strange noise function properly suspect might hardware well notice peculiar error message pop screen say mean,Critical,Email,1,0,0,False
order user concern security would like ensure data safe,Critical,Chat,1,0,0,False
seem hardware problem screen flicker unable use option disable remove noticed occurs consistently use specific feature application,High,Social media,1,0,0,False
tell discover product description new product use new name longer use product description page experience multiple device model seem widespread problem,Critical,Email,1,0,0,False
trouble connect home wifi network doesnt detect network although device connect fine do resolve wifi rely heavily daily task hinder productivity,High,Chat,1,0,0,False
share news case bring attention shortly november accident office say statement use original charger come charge properly,Critical,Social media,1,0,0,False
next step upgrade plus price s feel free contact forum check device setting make sure everything configure correctly,High,Phone,1,0,0,False
trouble connect home wifi network doesnt detect network although device connect fine do resolve l check device setting make sure everything configure correctly,Critical,Social media,1,0,0,False
need use code try use different cable adapter peripheral persists,High,Social media,1,0,0,False
product originally list ship friday february shipping face intermittent sometimes work fine time act unexpectedly,Critical,Phone,1,0,0,False
seem glitch software freeze frequently make difficult use provide solution well offer workaround step worry might hardwarerelated might require repair replacement,High,Phone,1,0,0,False
example dont want use custom price button arent receive package question leave concern security would like ensure data safe,Critical,Phone,1,0,0,False
client threadinfo chat client threadinfo chat already contact customer support multiple time remain unresolved,High,Social media,1,0,0,False
may also send message regard newsletter number message limit error policy follow troubleshoot step mention user manual persists,Critical,Phone,1,0,0,False
,High,Email,1,0,0,False
access logout try different setting configuration persists,Critical,Phone,1,0,0,False
command never execute product incomplete miss productname apply previous query notice peculiar error message pop screen say mean,Critical,Social media,1,0,0,False
product name product description product check available software update none,High,Phone,1,0,0,False
product list match anything systemwide none,Critical,Email,1,0,0,False
seem glitch software freeze frequently make difficult use provide solution complete list s read faq call rely heavily daily task hinder productivity,Critical,Chat,1,0,0,False
downloaded code see something say code nexus well download check software update already run late version,Critical,Social media,1,0,0,False
checked device setting make sure everything configure correctly,High,Email,1,0,0,False
product ship one state new jersey order send small required documentation complete form already contact customer support multiple time remain unresolved,Critical,Phone,1,0,0,False
can not understand name contact verify interested product choose create survey email concerned security would like ensure data safe,High,Email,1,0,0,False
note function use determine purchase sell customer gn date example problem start occur recent software update havent make change device,Low,Chat,0,1,1,False
seem hardware problem screen flicker unable use default apple higher already contact customer support multiple time remain unresolved,Critical,Chat,1,0,0,False
seem hardware problem screen flicker unable use answer use third option face intermittent sometimes work fine time act unexpectedly,Low,Social media,0,0,1,False
use product device use least time device fund must transfer check available software update none,High,Chat,1,0,0,False
accidentally delete important data way recover delete file need urgently possible recover delete people assume multiple checked device setting make sure everything configure correctly,High,Social media,1,0,0,False
use open select plugin list click add perform factory reset hop would resolve problem didnt,High,Chat,1,0,0,False
next day two people saw package hand ask whether buyer valid follow troubleshooting step mention user manual persists,Critical,Social media,1,0,0,False
see number company include ebay etsy popular shop see product notice sudden decrease battery life use last much long,High,Phone,1,0,0,False
face s log account say account lock unlock go take payment start scratch notice occurs consistently use specific feature application,High,Chat,1,0,0,False
need reset current purchase number error unable find option perform desire action could guide step,High,Email,1,0,0,False
item can not purchase current order rest item available purchase item can not notice sudden decrease battery life use last much long,High,Email,1,0,0,False
