Ticket Description,Ticket Priority,Ticket Channel,Urgency,Resolution_Time_Bin,Urgency_from_Text,Coincide
productpurchased daily task hinder productivity,High,Social media,1,0,0,False
unable establish stable internet connection keep disconnect intermittently troubleshoot network problem open console appear startup prompt window find unable find option perform desire action could guide step,Critical,Email,1,0,0,False
restriction number customer may subscribe possible may able rece order prior face intermittent sometimes work fine time act unexpectedly,High,Social media,1,0,0,False
face problem turn work fine yesterday doesnt respond call phone face intermittent sometimes work fine time act unexpectedly,High,Social media,1,0,0,False
something youre see purchase send message ill remove list product enter follow online tutorial community forums troubleshoot luck far,High,Phone,1,0,0,False
encounter software bug whenever try perform specific action application crash update fix available update provide developer note concerned security would like ensure data safe,Low,Phone,0,0,1,False
unable establish stable internet connection keep disconnect intermittently troubleshoot network problem windows install follow command ensure windows computer check available software update none,High,Phone,1,0,0,False
may purchase something account may cancel contact seller directly already run late version,High,Phone,1,0,0,False
make difficult people use app ill figure well solution make difficult people use noticed peculiar error message pop screen say mean,Critical,Phone,1,0,0,False
forgotten password account password reset option work recover account user either open user center new tab leave tried use different cable adapter peripheral persists,Critical,Chat,1,0,0,False
accidentally delete important data way recover delete file need urgently product service purchase deleted product service send unable find option perform desire action could guide step,Critical,Social media,1,0,0,False
array contain every type product productname array notice occurs consistently use specific feature application,Critical,Social media,1,0,0,False
see product purchase dont sell new release two day notice occurs consistently use specific feature application,Critical,Email,1,0,0,False
forgotten password account password reset option work recover account case havent already procedure available recover account follow online tutorial community forums troubleshoot luck far,High,Email,1,0,0,False
crash lose data store way recover lose data use usb mac device able recover data follow troubleshooting step mention user manual persists,Low,Phone,0,0,1,False
item backordered click next checkout process disable check try use different cable adapter peripheral persists,High,Chat,1,0,0,False
name ben know customer service way avoid charge service need ance soon possible affect work productivity,High,Social media,1,0,0,False
notice software bug app cause data loss unexpected error resolve download late version contact support get need ance soon possible affect work productivity,Medium,Phone,0,0,1,False
send detail developer make change within android app use noticed occurs consistently use specific feature application,Critical,Chat,1,0,0,False
unable find option perform desire action could guide step,High,Chat,1,0,0,False
checked device setting make sure everything configure correctly,Critical,Social media,1,0,0,False
notice software bug app cause data loss unexpected error resolve setting data protection policy application protection follow troubleshooting step mention user manual persists,Medium,Chat,0,0,1,False
recently set fails connect available network step take troubleshoot know error authentication notice peculiar error message pop screen say mean,High,Chat,1,0,0,False
talk store manager discus soon productpurch worried might hardwarerelated might require repair replacement,High,Email,1,0,0,False
end unable find answer system problem solve new feature need ance soon possible affect work productivity,Critical,Email,1,0,0,False
take picture daughter play game game background need ance soon possible affect work productivity,Critical,Phone,1,0,0,False
encounter software bug whenever try perform specific action application crash update fix available send email already contact customer support multiple time remain unresolved,Low,Social media,0,0,1,False
forgotten password account password reset option work recover account password appear lose change already account experience multiple device model seem widespread problem,Critical,Social media,1,0,0,False
productpurchased already contact customer support multiple time remain unresolved,High,Phone,1,0,0,False
productpurch sure specific device others report similar problem,High,Social media,1,0,0,False
recently set fails connect available network step take troubleshoot update january problem start occur recent software update havent make change device,Medium,Email,0,0,1,False
encounter software bug whenever try perform specific action application crash update fix available change make current change changing concerned security would like ensure data safe,Low,Chat,0,0,1,False
product add value product add value product appear part follow category available checked device setting make sure everything configure correctly,Critical,Phone,1,0,0,False
provide valid title name distributor notice call name receive request correct try use different cable adapter peripheral persists,Critical,Phone,1,0,0,False
encounter software bug whenever try perform specific action application crash update fix available work new feature upcoming release product follow troubleshooting step mention user manual persists,Medium,Email,0,0,1,False
check item use url check whether item order current currency worry might hardwarerelated might require repair replacement,High,Phone,1,0,0,False
best way make sure user notify soon product make available last minute try clear cache data app persists,High,Email,1,0,0,False
make one day depend noticed peculiar error message pop screen say mean,High,Chat,1,0,0,False
recently set fails connect available network step take troubleshoot attempt connect default local network check problem start occur recent software update havent make change device,Low,Chat,0,0,1,False
product sell crave notice peculiar error message pop screen say mean,Critical,Email,1,0,0,False
unable access account keep display invalid credential error even though use correct login information regain access account use original charger come charge properly,High,Chat,1,0,0,False
note code fix newbie notice peculiar error message pop screen say mean,Critical,Social media,1,0,0,False
already contact customer support multiple time remain unresolved,Critical,Chat,1,0,0,False
there problem let support team know gear currently available part update due checked device setting make sure everything configure correctly,High,Phone,1,0,0,False
take time write tried late android wear notice facing intermittent sometimes work fine time act unexpectedly,High,Email,1,0,0,False
note can not accept duplicate offer unless agree pay price worry might hardwarerelated might require repair replacement,High,Chat,1,0,0,False
must contain product tried troubleshooting step mention user manual persists,Critical,Phone,1,0,0,False
support nexus team purchase app device special offer ensure device display credit try use different cable adapter peripheral persists,High,Social media,1,0,0,False
product number specified product price unknown provide product number box purchase confirmation order check item add noticed peculiar error message pop screen say mean,High,Phone,1,0,0,False
contact email try clear cache data app persists,High,Phone,1,0,0,False
vote click view comment print card name mana cost convert mana cost worry might hardwarerelated might require repair replacement,High,Email,1,0,0,False
review troubleshoot step official support website didnt resolve problem,High,Phone,1,0,0,False
couple people find ful advertisement continue read main story answer like get notice peculiar error message pop screen say mean,Critical,Social media,1,0,0,False
still see work contact fix need ance soon possible affect work productivity,Critical,Phone,1,0,0,False
product purchase use product sell sale resold try troubleshoot step mention user manual persists,Critical,Phone,1,0,0,False
code name good thing doesnt work languages let know use use original charger come charge properly,Critical,Phone,1,0,0,False
need ance soon possible affect work productivity,Critical,Social media,1,0,0,False
add new payment payment place soon performed factory reset hop would resolve problem didnt,Critical,Email,1,0,0,False
unable establish stable internet connection keep disconnect intermittently troubleshoot network problem note thing happen web apps unable find option perform desire action could guide step,Critical,Email,1,0,0,False
product require purchase easily clean nice little shop problem start occur recent software update havent make change device,Critical,Email,1,0,0,False
name experience pretty good interesting experience problem experience multiple device model seem widespread problem,High,Email,1,0,0,False
incomplete payment paypal click pay checkout download copy ebook worry might hardwarerelated might require repair replacement,Critical,Phone,1,0,0,False
rely heavily daily task hinder productivity,Critical,Phone,1,0,0,False
unable access account keep display invalid credential error even though use correct login information regain access account solution unable find option perform desire action could guide step,Critical,Chat,1,0,0,False
make strange noise function properly suspect might hardware case printer one printer try different setting configuration persists,Critical,Email,1,0,0,False
add cart product number product display read product field indicate order online check software update already run late version,High,Phone,1,0,0,False
copyright inc need ance soon possible affect work productivity,High,Phone,1,0,0,False
recently set fails connect available network step take troubleshoot cant find manufacturer brand find check available software update none,Critical,Social media,1,0,0,False
product isnt stock might sell stock face intermittent sometimes work fine time act unexpectedly,High,Phone,1,0,0,False
notice software bug app cause data loss unexpected error resolve app deprecate fix open app try different setting configuration persists,Medium,Phone,0,0,1,False
make strange noise function properly suspect might hardware review troubleshoot step official support website didnt resolve problem,High,Phone,1,0,0,False
get bunch crap message break product name dont know perform factory reset hop would resolve problem didnt,High,Social media,1,0,0,False
accidentally delete important data way recover delete file need urgently bug data may lose lose download didnt perform factory reset hop would resolve problem didnt,Critical,Email,1,0,0,False
payment process account login well refund account deposit pay shipment dont send perform factory reset hop would resolve problem didnt,Critical,Phone,1,0,0,False
notice software bug app cause data loss unexpected error resolve app currently run fast perform factory reset hop would resolve problem didnt,Low,Chat,0,0,1,False
seem glitch software freeze frequently make difficult use provide solution yes consideration leave sure specific device others report similar problem,Medium,Email,0,0,1,False
buy marketplace change name contact someone least get contact message problem start occur recent software update havent make change device,High,Social media,1,0,0,False
send email sent productpurchased confirm order need verify information correct concern security would like ensure data safe,Critical,Phone,1,0,0,False
contact via email need purchase make purchasing instruction product picture less confuse refer check available software update none,Critical,Email,1,0,0,False
ticket holder pretty sure store get ticket get ticket soon need ance soon possible affect work productivity,Critical,Chat,1,0,0,False
recently set fails connect available network step take troubleshoot update follow necessary step concerned security would like ensure data safe,Critical,Chat,1,0,0,False
performed factory reset hop would resolve problem didnt,Critical,Chat,1,0,0,False
find need remove order send package replace desire one problem start occur recent software update havent make change device,Critical,Social media,1,0,0,False
worried might hardwarerelated might require repair replacement,Critical,Chat,1,1,0,False
forgotten password account password reset option work recover account recover account access email account use original charger come charge properly,Critical,Phone,1,0,0,False
recently set fails connect available network step take troubleshoot take least minute device check available software update none,High,Social media,1,0,0,False
product pack pack pack pack rely heavily daily task hinder productivity,Critical,Chat,1,0,0,False
forgotten password account password reset option work recover account call account manager contact local system support experience multiple device model seem widespread problem,Critical,Chat,1,0,0,False
go make invoice include product buy anything email still try different setting configuration persists,High,Email,1,0,0,False
seem hardware problem screen flicker unable use download client provide simple make perform factory reset hop would resolve problem didnt,Low,Social media,0,0,1,False
mike fix option would disappear game restart twice worried might hardwarerelated might require repair replacement,Critical,Phone,1,0,0,False
recently set fails connect available network step take troubleshoot router set new address face intermittent sometimes work fine time act unexpectedly,Critical,Chat,1,0,0,False
youre alone november huge demand update experience multiple device model seem widespread problem,High,Social media,1,0,0,False
make strange noise function properly suspect might hardware tried different setting configuration persists,Critical,Email,1,0,0,False
dont new device available would mean concerned security would like ensure data safe,Critical,Chat,1,0,0,False
note parameter identifier product create unable find option perform desire action could guide step,Critical,Phone,1,0,0,False
div experience multiple device model seem widespread problem,High,Social media,1,0,0,False
recently set fails connect available network step take troubleshoot open open microsoft azure tool service link performed factory reset hop would resolve problem didnt,High,Social media,1,0,0,False
good thing say first mean already contact customer support multiple time remain unresolved,High,Chat,1,0,0,False
face s log account say account lock unlock account lock screen log password click next already contact customer support multiple time remain unresolved,High,Email,1,0,0,False
purchase product experience multiple device model seem widespread problem,High,Email,1,0,0,False
seem glitch software freeze frequently make difficult use provide solution always try best try fix thing experience multiple device model seem widespread problem,Medium,Chat,0,0,1,False
face intermittent sometimes work fine time act unexpectedly,High,Email,1,0,0,False
could use people project brick brick open source software currently work recently update firmware start happen afterward could relate update,Critical,Social media,1,0,0,False
item range want item place would include item purchase free shipping track follow online tutorial community forums troubleshoot luck far,Critical,Phone,1,0,0,False
notice peculiar error message pop screen say mean,High,Phone,1,0,0,False
trouble connect home wifi network doesnt detect network although device connect fine do resolve able follow troubleshoot step mention user manual persists,High,Email,1,0,0,False
contact thing get answer part question highly recommend dont need ance soon possible affect work productivity,High,Chat,1,0,0,False
recently set fails connect available network step take troubleshoot app perform factory reset hop would resolve problem didnt,Critical,Chat,1,0,0,False
ability offer refund company say product purchased member purchase subscription face intermittent sometimes work fine time act unexpectedly,High,Email,1,0,0,False
recently set fails connect available network step take troubleshoot troubleshoot need open new terminal emulator try use different cable adapter peripheral persists,Critical,Social media,1,0,0,False
input typesubmit link follow troubleshooting step mention user manual persists,High,Phone,1,0,0,False
note code provide signing account agree beta verification use agreement face intermittent sometimes work fine time act unexpectedly,Critical,Chat,1,0,0,False
there nothing error theres nothing face intermittent sometimes work fine time act unexpectedly,Critical,Chat,1,0,0,False
make strange noise function properly suspect might hardware read article couldnt need ance soon possible affect work productivity,High,Chat,1,0,0,False
enable service wont show product may check one three option device screen notice peculiar error message pop screen say mean,Critical,Chat,1,0,0,False
last name item sell far cant product order miss face intermittent sometimes work fine time act unexpectedly,Critical,Chat,1,0,0,False
use device purchase youre use mobile device use download install new device function rely heavily daily task hinder productivity,Critical,Email,1,0,0,False
set step make purchase step ready start recently update firmware start happen afterward could relate update,High,Chat,1,0,0,False
may choose use purchase method payment price premium use original charger come charge properly,Critical,Email,1,0,0,False
unable find one product ebay see order second confirm worry might hardwarerelated might require repair replacement,Critical,Chat,1,0,0,False
encounter data loss file document seem disappear guide retrieve cant way know follow online tutorial community forums troubleshoot luck far,High,Phone,1,0,0,False
recently set fails connect available network step take troubleshoot first download package http use original charger come charge properly,High,Chat,1,0,0,False
encounter data loss file document seem disappear guide retrieve get touch perform factory reset hop would resolve problem didnt,High,Chat,1,0,0,False
recently update firmware start happen afterward could relate update,Critical,Social media,1,0,0,False
seem glitch software freeze frequently make difficult use provide solution question safely disable annoy performed factory reset hop would resolve problem didnt,Medium,Phone,0,0,1,False
price product usd product may need filled purchase may need unable find option perform desire action could guide step,Critical,Social media,1,0,0,False
here sample code sample use case class product model worry might hardwarerelated might require repair replacement,Critical,Phone,1,0,0,False
unable access account keep display invalid credential error even though use correct login information regain access account try troubleshoot step mention user manual persists,High,Chat,1,0,0,False
want know youre get there brand food youd like order online store dont want check device setting make sure everything configure correctly,Critical,Chat,1,0,0,False
allow sell transfer item mark non use also plan sell thing already contact customer support multiple time remain unresolved,Critical,Phone,1,0,0,False
seem hardware problem screen flicker unable use try open desktop problem would face intermittent sometimes work fine time act unexpectedly,Medium,Chat,0,0,1,False
notice software bug app cause data loss unexpected error resolve youve notice app crash device try use different cable adapter peripheral persists,Low,Email,0,0,1,False
consideration write message send friend husband buy mine month ago problem follow online tutorial community forums troubleshoot luck far,Critical,Phone,1,0,0,False
go fix doesnt matter never go fix problem matter happen face intermittent sometimes work fine time act unexpectedly,Critical,Social media,1,0,0,False
trouble connect home wifi network doesnt detect network although device connect fine do resolve solution turn notice peculiar error message pop screen say mean,Critical,Phone,1,0,0,False
provide payment option paypal credit card paypal sender mail etc use payment method indicate tried use different cable adapter peripheral persists,Critical,Chat,1,0,0,False
work add cart reced response morning ask get response say would make checked device setting make sure everything configure correctly,High,Social media,1,1,0,False
forgotten password account password reset option work recover account verify identity card information go settings account check box already contact customer support multiple time remain unresolved,High,Social media,1,0,0,False
trouble package need contact customer service follow website box notice sudden decrease battery life use last much long,High,Email,1,0,0,False
info patch need ance soon possible affect work productivity,Critical,Phone,1,0,0,False
recently set fails connect available network step take troubleshoot get network look connect perform factory reset hop would resolve problem didnt,Critical,Phone,1,0,0,False
dont want sell see worried might hardwarerelated might require repair replacement,Critical,Chat,1,0,0,False
server threadinfo chat hey server thread checked device setting make sure everything configure correctly,High,Social media,1,0,0,False
customer support customersupport february customer tell see similar change refund process sure specific device others report similar problem,Critical,Email,1,0,0,False
new product add cart item new item sale seller make refund review troubleshoot step official support website didnt resolve problem,Critical,Social media,1,0,0,False
unable establish stable internet connection keep disconnect intermittently troubleshoot network problem configure router disconnect computer question concerned security would like ensure data safe,High,Social media,1,0,0,False
try figure exactly customer need one solve read perform factory reset hop would resolve problem didnt,Critical,Email,1,0,0,False
refund exchange new developer dont offer one recently update firmware start happen afterward could relate update,Critical,Phone,1,0,0,False
recently set fails connect available network step take troubleshoot try send email code unable find option perform desire action could guide step,High,Chat,1,0,0,False
encounter software bug whenever try perform specific action application crash update fix available http need ance soon possible affect work productivity,Low,Chat,0,0,1,False
seem glitch software freeze frequently make difficult use provide solution jim possible solution provide solution rely heavily daily task hinder productivity,High,Social media,1,0,0,False
charge rece app use api key also call api key web api concerned security would like ensure data safe,High,Chat,1,0,0,False
unable establish stable internet connection keep disconnect intermittently troubleshoot network problem easy access follow online tutorial community forums troubleshoot luck far,High,Social media,1,0,0,False
label review troubleshoot step official support website didnt resolve problem,Critical,Email,1,0,0,False
base value gn sign newsletter agree delry privacy policy data protection rule try troubleshoot step mention user manual persists,Critical,Social media,1,0,0,False
recently set fails connect available network step take troubleshoot problem start occur recent software update havent make change device,Medium,Phone,0,0,1,False
require account product buy return credit card information use provide service return notice occurs consistently use specific feature application,High,Chat,1,0,0,False
trouble connect home wifi network doesnt detect network although device connect fine do resolve check software update already run late version,Critical,Phone,1,0,0,False
minor app design well people gift card try later follow troubleshoot step mention user manual persists,High,Chat,1,0,0,False
follow matter many year take look every often say might unable find option perform desire action could guide step,Critical,Chat,1,1,0,False
forgotten password account password reset option work recover account recover login reset password productp experience multiple device model seem widespread problem,Critical,Email,1,0,0,False
work problem click start button right change ship address paste address recently update firmware start happen afterward could relate update,Critical,Phone,1,0,0,False
reced email product duty email address correct question use original charger come charge properly,High,Social media,1,0,0,False
unable access account keep display invalid credential error even though use correct login information regain access account visit try troubleshoot step mention user manual persists,Critical,Phone,1,1,0,False
accidentally delete important data way recover delete file need urgently emote experience multiple device model seem widespread problem,High,Social media,1,0,0,False
notice software bug app cause data loss unexpected error resolve company offer process prevent problem detail check device setting make sure everything configure correctly,Medium,Email,0,0,1,False
face problem turn work fine yesterday doesnt respond try first time try check available software update none,Critical,Phone,1,0,0,False
copy refund request usually find link note happy item may need ance soon possible affect work productivity,High,Phone,1,0,0,False
one use method youll use future work product recently update firmware start happen afterward could relate update,Critical,Email,1,0,0,False
tried troubleshoot step mention user manual persists,Critical,Email,1,0,0,False
purchase can not ship product quantity product product product rely heavily daily task hinder productivity,Critical,Email,1,0,0,False
