Ticket Description,Ticket Priority,Ticket Channel,Urgency,Resolution_Time_Bin,Urgency_from_Text,Coincide
recently set fails connect available network step take troubleshoot use appropriate router router notice sudden decrease battery life use last much long,Critical,Social media,1,0,0,False
seem hardware problem screen flicker unable use first step try locate fix problem see problem start occur recent software update havent make change device,Medium,Social media,0,0,1,False
name return name face intermittent sometimes work fine time act unexpectedly,Critical,Chat,1,0,0,False
seem glitch software freeze frequently make difficult use provide solution try clear cache data app persists,High,Social media,1,0,0,False
product lot people dont pay enough get want want guy buy favorite thing rely heavily daily task hinder productivity,Critical,Phone,1,1,0,False
let know anyone question s aware possible item miss notice sudden decrease battery life use last much long,High,Social media,1,1,0,False
feel can not use product visit support team worry might hardwarerelated might require repair replacement,High,Phone,1,0,0,False
check software update already run late version,Critical,Social media,1,0,0,False
notice software bug app cause data loss unexpected error resolve make sure youre run valid account app doesnt g rely heavily daily task hinder productivity,Medium,Social media,0,0,1,False
check software update already run late version,High,Phone,1,0,0,False
face s log account say account lock unlock worried might hardwarerelated might require repair replacement,High,Social media,1,0,0,False
product need one ordered price tag theres discount experience multiple device model seem widespread problem,Critical,Chat,1,0,0,False
crash lose data store way recover lose data post computer work great try recently update firmware start happen afterward could relate update,Medium,Phone,0,0,1,False
seem hardware problem screen flicker unable use let find way fix use already contact customer support multiple time remain unresolved,Critical,Email,1,0,0,False
youre problem sell product contact event emergency dont g product already contact customer support multiple time remain unresolved,High,Chat,1,0,0,False
recently set fails connect available network step take troubleshoot server detect new product might follow troubleshoot step mention user manual persists,High,Chat,1,0,0,False
anastasia content refer description item anastasia first time rely heavily daily task hinder productivity,Critical,Social media,1,0,0,False
forgotten password account password reset option work recover account,High,Chat,1,0,0,False
unable access account keep display invalid credential error even though use correct login information regain access account already contact customer support multiple time remain unresolved,High,Social media,1,0,0,False
face s log account say account lock unlock admin tell awhile actually allow thats good noticed occurs consistently use specific feature application,Critical,Email,1,0,0,False
add cart select size try use different cable adapter peripheral persists,High,Social media,1,1,0,False
android phone notice peculiar error message pop screen say mean,High,Email,1,0,0,False
encounter data loss file document seem disappear guide retrieve know others web seem try use different cable adapter peripheral persists,High,Email,1,0,0,False
right cant see name notice sudden decrease battery life use last much long,High,Email,1,0,0,False
accidentally delete important data way recover delete file need urgently delete item andor system explorer notice sudden decrease battery life use last much long,High,Email,1,0,0,False
support bugfix work related release schedule worry might hardwarerelated might require repair replacement,Critical,Phone,1,0,0,False
ask cant fix least provide wrong information didnt buy purchase review troubleshoot step official support website didnt resolve problem,High,Social media,1,0,0,False
sometimes appear though miss something get bad code either case try less complicated step fix check software update already run late version,Critical,Email,1,0,0,False
encounter data loss file document seem disappear guide retrieve seem simple ill use noticed sudden decrease battery life use last much long,High,Phone,1,0,0,False
encounter data loss file document seem disappear guide retrieve part try different setting configuration persists,Critical,Chat,1,0,0,False
would love call s may customer revise already contact customer support multiple time remain unresolved,High,Email,1,0,0,False
message youre receive contains code address indicate address pay account unable find option perform desire action could guide step,Critical,Chat,1,0,0,False
review troubleshoot step official support website didnt resolve problem,High,Email,1,0,0,False
attempt place thats case mean customer customer concern security would like ensure data safe,High,Chat,1,0,0,False
want use go account page purchase product account buy worried might hardwarerelated might require repair replacement,Critical,Phone,1,0,0,False
support try everything feeling cant make use original charger come charge properly,High,Email,1,0,0,False
remy cant understand people buy worth much perform factory reset hop would resolve problem didnt,High,Phone,1,0,0,False
cody may utc tell change code follow troubleshooting step mention user manual persists,Critical,Social media,1,1,0,False
unable access account keep display invalid credential error even though use correct login information regain access account follow troubleshoot step mention user manual persists,Critical,Social media,1,0,0,False
sigh decide get laptop recently update firmware start happen afterward could relate update,High,Phone,1,0,0,False
face problem turn work fine yesterday doesnt respond software work fine try clear cache data app persists,Critical,Email,1,0,0,False
understand problem user support sure specific device others report similar problem,High,Email,1,0,0,False
code cant able provide credit need purchase payment recently update firmware start happen afterward could relate update,Critical,Phone,1,0,0,False
use original charger come charge properly,High,Email,1,0,0,False
product code package case package submit concerned security would like ensure data safe,Critical,Phone,1,0,0,False
see product mark sale sale field describe could still try troubleshoot step mention user manual persists,Critical,Social media,1,0,0,False
thing relate ship ill review many different option track custom paypal exact weight dimension try use different cable adapter peripheral persists,Critical,Social media,1,0,0,False
accidentally delete important data way recover delete file need urgently delete file remain online yes certain item try troubleshoot step mention user manual persists,High,Social media,1,1,0,False
youre auto car repair business place order youre leave bad part problem start occur recent software update havent make change device,Critical,Phone,1,0,0,False
face problem turn work fine yesterday doesnt respond go microsoft support desk last night experience multiple device model seem widespread problem,High,Phone,1,0,0,False
order ensure take little time rece product send track number computer somewhere within matter day try use different cable adapter peripheral persists,High,Email,1,0,0,False
encounter software bug whenever try perform specific action application crash update fix available possible particular number may fall sync sure specific device others report similar problem,Low,Social media,0,0,1,False
app system try later app system try later recently update firmware start happen afterward could relate update,High,Phone,1,0,0,False
way rece address go directly product youve place even brand recently update firmware start happen afterward could relate update,Critical,Social media,1,0,0,False
unable establish stable internet connection keep disconnect intermittently troubleshoot network problem router handle intermittent disconnect trouble face intermittent sometimes work fine time act unexpectedly,High,Chat,1,0,0,False
encounter data loss file document seem disappear guide retrieve aug already contact customer support multiple time remain unresolved,Critical,Email,1,0,0,False
thats saw lot people say dont say dont bother heard friend perform factory reset hop would resolve problem didnt,High,Email,1,0,0,False
recently update firmware start happen afterward could relate update,Critical,Chat,1,0,0,False
cart look like youre experience multiple device model seem widespread problem,High,Phone,1,0,0,False
override protect void throw new system string tried clearing cache data app persists,Critical,Social media,1,0,0,False
encounter data loss file document seem disappear guide retrieve process retrieve data vendor follow need ance soon possible affect work productivity,Critical,Email,1,0,0,False
price product purchase refers purchase price total price typically well offer discount check available software update none,Critical,Social media,1,0,0,False
everyone response really good time hope dont work together long well get hurt performed factory reset hop would resolve problem didnt,High,Social media,1,0,0,False
accidentally delete important data way recover delete file need urgently somebody take keep data small folder without hassle check available software update none,Critical,Email,1,0,0,False
refer online product guide contain information making product sale include informat informat description may make product face intermittent sometimes work fine time act unexpectedly,Critical,Phone,1,0,0,False
seem there bug api youll want enable use url want display concern security would like ensure data safe,Critical,Phone,1,0,0,False
try fix s greeting label case check device setting make sure everything configure correctly,Critical,Email,1,0,0,False
product fail reach product need ance soon possible affect work productivity,Critical,Email,1,0,0,False
product purchase request try different setting configuration persists,High,Email,1,0,0,False
encounter data loss file document seem disappear guide retrieve retrieve database item try different setting configuration persists,Critical,Social media,1,0,0,False
product appear approve team yet contact team request information appreciate feedback do find noticed peculiar error message pop screen say mean,High,Social media,1,0,0,False
device get stick specific app sure specific device others report similar problem,Critical,Phone,1,0,0,False
face problem turn work fine yesterday doesnt respond problem start occur recent software update havent make change device,Critical,Chat,1,0,0,False
website link state unavailable doesnt exist notice peculiar error message pop screen say mean,Critical,Social media,1,0,0,False
make strange noise function properly suspect might hardware noticed peculiar error message pop screen say mean,Critical,Chat,1,0,0,False
something broken notify customer fix here photo reddit user find go wrong here photo unable find option perform desire action could guide step,High,Social media,1,0,0,False
disable purchase within day allow rece item order follow online tutorial community forums troubleshoot luck far,Critical,Email,1,0,0,False
product item already stock note sell order product sell transfer customer data use original charger come charge properly,High,Email,1,0,0,False
app store purchase store later use information apps doc face intermittent sometimes work fine time act unexpectedly,Critical,Social media,1,0,0,False
large distributor world cannabis countless brand cannabis size change follow online tutorial community forums troubleshoot luck far,High,Chat,1,0,0,False
recently set fails connect available network step take troubleshoot order determine status network see notice peculiar error message pop screen say mean,High,Phone,1,0,0,False
unable establish stable internet connection keep disconnect intermittently troubleshoot network problem perform factory reset hop would resolve problem didnt,Critical,Email,1,0,0,False
added fix error app troubleshoot try clear cache data app persists,High,Social media,1,0,0,False
first product productpurchased key simple array item product name age product description try different setting configuration persists,Critical,Phone,1,0,0,False
problem test service product already contact customer support multiple time remain unresolved,High,Email,1,0,0,False
log account youve create important use right tool log username email address account check software update already run late version,High,Social media,1,0,0,False
name generic def already run late version,High,Social media,1,0,0,False
automatically rece item added transaction successful proceed display select item perform factory reset hop would resolve problem didnt,High,Social media,1,0,0,False
forgotten password account password reset option work recover account open file write follow line rely heavily daily task hinder productivity,High,Email,1,0,0,False
add email list checkout sure include name noticed peculiar error message pop screen say mean,High,Phone,1,0,0,False
way tell device ship unable find option perform desire action could guide step,High,Social media,1,0,0,False
currently phone call shop can not update phone may turn time excellent customer try use different cable adapter peripheral persists,Critical,Social media,1,0,0,False
purchase make product original form display app mean cant buy rely heavily daily task hinder productivity,High,Social media,1,0,0,False
confused sure check mod include one call sierra newbie experience multiple device model seem widespread problem,Critical,Social media,1,0,0,False
notice sudden decrease battery life use last much long,Critical,Social media,1,0,0,False
way worry might hardwarerelated might require repair replacement,High,Email,1,1,0,False
trouble connect home wifi network doesnt detect network although device connect fine do resolve best solution unable find option perform desire action could guide step,Critical,Chat,1,0,0,False
face s log account say account lock unlock would use phone lock screen option enter yes screen wait rely heavily daily task hinder productivity,Critical,Social media,1,0,0,False
purchase product send gift would want gift person use original charger come charge properly,Critical,Phone,1,0,0,False
worried phone want keep thing clean phone take standard battery charge quickly however recently update firmware start happen afterward could relate update,High,Social media,1,0,0,False
face s log account say account lock unlock locked purchase within last hour need ance soon possible affect work productivity,Critical,Email,1,0,0,False
notice software bug app cause data loss unexpected error resolve several method moment available solve face intermittent sometimes work fine time act unexpectedly,Low,Chat,0,0,1,False
need ance soon possible affect work productivity,High,Chat,1,0,0,False
product code estimate shipping time s use product small small size shipping notice peculiar error message pop screen say mean,Critical,Social media,1,0,0,False
make strange noise function properly suspect might hardware weird noise face intermittent sometimes work fine time act unexpectedly,Critical,Email,1,0,0,False
good sign get right product dont know product place wont work type unable find option perform desire action could guide step,High,Chat,1,0,0,False
tell friend pick click store available check box bottom right next follow troubleshooting step mention user manual persists,Critical,Phone,1,0,0,False
price currently usd per person youre look concerned security would like ensure data safe,High,Email,1,0,0,False
face problem turn work fine yesterday doesnt respond also bad notice sudden decrease battery life use last much long,High,Chat,1,0,0,False
recently update firmware start happen afterward could relate update,Critical,Chat,1,1,0,False
unsure information correct email option concern security would like ensure data safe,Critical,Chat,1,0,0,False
forgotten password account password reset option work recover account recent security test confirm password reset option work unable find option perform desire action could guide step,Critical,Social media,1,0,0,False
productpurchased product ship product check device setting make sure everything configure correctly,Critical,Chat,1,0,0,False
unable access account keep display invalid credential error even though use correct login information regain access account last noticed sudden decrease battery life use last much long,High,Phone,1,0,0,False
add end name field first second name already contact customer support multiple time remain unresolved,High,Email,1,0,0,False
apologize inconvenience best friend youll ever absolutely love friend ever try use different cable adapter peripheral persists,Critical,Social media,1,0,0,False
click updated product policy notice peculiar error message pop screen say mean,High,Email,1,0,0,False
release include feature get api create instance product need ance soon possible affect work productivity,Critical,Chat,1,0,0,False
get poisonous water know poisonous get taste like crap thing also take need ance soon possible affect work productivity,Critical,Social media,1,0,0,False
make strange noise function properly suspect might hardware add know part rely heavily daily task hinder productivity,High,Chat,1,0,0,False
problem productpurchased product recently update firmware start happen afterward could relate update,Critical,Email,1,0,0,False
product provide functionality try delr product get desired experience charge functionality worry might hardwarerelated might require repair replacement,High,Chat,1,1,0,False
also work lot new feature ready week source tell wall street company ceo performed factory reset hop would resolve problem didnt,Critical,Email,1,0,0,False
cant anything want product sell thats expens transaction get something problem start occur recent software update havent make change device,Critical,Chat,1,0,0,False
there problem order contact preferably detail would like item quality already contact customer support multiple time remain unresolved,Critical,Social media,1,0,0,False
encounter software bug whenever try perform specific action application crash update fix available yes possible use original charger come charge properly,Medium,Chat,0,0,1,False
try create new product new company hope new product work well notice occurs consistently use specific feature application,Critical,Phone,1,0,0,False
try find fix problem recent laptop screen turn black red concerned security would like ensure data safe,High,Chat,1,0,0,False
accidentally delete important data way recover delete file need urgently recover data previous purchase use app computer follow online tutorial community forums troubleshoot luck far,High,Chat,1,0,0,False
unable establish stable internet connection keep disconnect intermittently troubleshoot network problem router vulnerable add address try use different cable adapter peripheral persists,Critical,Chat,1,0,0,False
really curious didnt add first product shop cart know give away ill happy use original charger come charge properly,Critical,Phone,1,0,0,False
product last updated paul new jersey check software update already run late version,High,Email,1,0,0,False
make strange noise function properly suspect might hardware response time perform factory reset hop would resolve problem didnt,High,Phone,1,0,0,False
encounter discrepancy contact well put behind know product send quickly hassle sure specific device others report similar problem,High,Email,1,0,0,False
seem glitch software freeze frequently make difficult use provide solution confirm fix perform factory reset hop would resolve problem didnt,Medium,Email,0,0,1,False
seem glitch software freeze frequently make difficult use provide solution appear glitch productpurchased need ance soon possible affect work productivity,High,Phone,1,0,0,False
youd like try refund particular product account may work correctly email customer care support refund concerned security would like ensure data safe,Critical,Email,1,0,0,False
accidentally delete important data way recover delete file need urgently think back back home place face intermittent sometimes work fine time act unexpectedly,High,Phone,1,0,0,False
add small amount favorite text product description important extremely sensit try change change recently update firmware start happen afterward could relate update,Critical,Chat,1,0,0,False
mention list product available purchase product name useful particular product make accessible easy sure specific device others report similar problem,High,Chat,1,0,0,False
open experience s email team immediately price last year concerned security would like ensure data safe,High,Email,1,0,0,False
product purchase quantity display product purchase quantity product problem start occur recent software update havent make change device,High,Chat,1,1,0,False
s find error dead fall product miss damage part notify need ance soon possible affect work productivity,Critical,Email,1,0,0,False
reced product name vendor email send error message follow message request error code recently update firmware start happen afterward could relate update,Critical,Social media,1,0,0,False
product request longer available third party collect use display information online otherwise sell rely heavily daily task hinder productivity,High,Phone,1,0,0,False
notice software bug app cause data loss unexpected error resolve add root location data device app review troubleshoot step official support website didnt resolve problem,Low,Chat,0,0,1,False
reason post send explain get situation use use original charger come charge properly,High,Social media,1,0,0,False
need ance soon possible affect work productivity,Critical,Email,1,0,0,False
item nonrefundable offer valid select order applicable item may remove ebay immediately recently update firmware start happen afterward could relate update,High,Chat,1,0,0,False
get email remove product warranty break reading experience find recently update firmware start happen afterward could relate update,High,Chat,1,0,0,False
unable establish stable internet connection keep disconnect intermittently troubleshoot network problem two thing may need figure resolve network worried might hardwarerelated might require repair replacement,High,Email,1,0,0,False
encounter data loss file document seem disappear guide retrieve use browser browser doesnt respond automatically concerned security would like ensure data safe,Critical,Chat,1,0,0,False
seem glitch software freeze frequently make difficult use provide solution yes need enable functionality read check software update already run late version,High,Email,1,0,0,False
encounter software bug whenever try perform specific action application crash update fix available far know appear software need ance soon possible affect work productivity,Low,Email,0,0,1,False
solve problem best question contact immediately use contact contact information follow troubleshoot step mention user manual persists,Critical,Email,1,0,0,False
encounter data loss file document seem disappear guide retrieve window machine data loss notice peculiar error message pop screen say mean,High,Social media,1,0,0,False
trouble connect home wifi network doesnt detect network although device connect fine do resolve turn app already contact customer support multiple time remain unresolved,High,Social media,1,0,0,False
enable javascript watch video department public safety today notice peculiar error message pop screen say mean,Critical,Social media,1,0,0,False
say mouse say unable find option perform desire action could guide step,High,Email,1,0,0,False
describe plan support purchase price willing pay item description display product price notice sudden decrease battery life use last much long,Critical,Social media,1,0,0,False
make strange noise function properly suspect might hardware face intermittent sometimes work fine time act unexpectedly,Critical,Phone,1,0,0,False
performed factory reset hop would resolve problem didnt,Critical,Email,1,0,0,False
might best solution would like receive end gift go send sure specific device others report similar problem,High,Social media,1,0,0,False
product product code name concerned security would like ensure data safe,High,Email,1,0,0,False
item list current box contain item current box yet check device setting make sure everything configure correctly,Critical,Chat,1,0,0,False
unable access account keep display invalid credential error even though use correct login information regain access account there check software update already run late version,High,Email,1,0,0,False
code originally post already contact customer support multiple time remain unresolved,Critical,Email,1,0,0,False
unable establish stable internet connection keep disconnect intermittently troubleshoot network problem set dns service provider check concerned security would like ensure data safe,High,Chat,1,0,0,False
order make purchase item original state find online dont use search check software update already run late version,Critical,Social media,1,0,0,False
face problem turn work fine yesterday doesnt respond get text error notice occurs consistently use specific feature application,Critical,Phone,1,0,0,False
encounter software bug whenever try perform specific action application crash update fix available yes check sure specific device others report similar problem,Medium,Email,0,0,1,False
face s log account say account lock unlock question feel free reach ill try tried different setting configuration persists,High,Email,1,0,0,False
contact inconvenience request within next hour result performed factory reset hop would resolve problem didnt,Critical,Social media,1,0,0,False
notice peculiar error message pop screen say mean,High,Phone,1,0,0,False
already run late version,Critical,Chat,1,0,0,False
sure specific device others report similar problem,High,Email,1,0,0,False
