Ticket Description,Ticket Priority,Ticket Channel,Urgency,Resolution_Time_Bin,Urgency_from_Text,Coincide
bill code appreciate request website address double check email address try troubleshooting step mention user manual persists,Critical,Social media,1,0,0,False
need change exist product face intermittent sometimes work fine time act unexpectedly,Critical,Chat,1,0,0,False
unable access account keep display invalid credential error even though use correct login information regain access account solution unable find option perform desire action could guide step,Critical,Social media,1,0,0,False
contact supplier confirm try find whether inventory currently stock reason perform factory reset hop would resolve problem didnt,Critical,Social media,1,0,0,False
make strange noise function properly suspect might hardware send request face intermittent sometimes work fine time act unexpectedly,Critical,Phone,1,0,0,False
product search whats new report feedback customer service best use original charger come charge properly,High,Phone,1,0,0,False
possible can not find type text product name identify someone like brown review troubleshoot step official support website didnt resolve problem,High,Chat,1,0,0,False
product name join date oct post quote recently update firmware start happen afterward could relate update,High,Chat,1,0,0,False
note might already pay product mean buying product sale donation straight noticed sudden decrease battery life use last much long,High,Social media,1,0,0,False
dan purchase new product store local retailer also provide concerned security would like ensure data safe,Critical,Chat,1,0,0,False
product sell use review troubleshoot step official support website didnt resolve problem,High,Chat,1,0,0,False
want act member community youtube face intermittent sometimes work fine time act unexpectedly,High,Social media,1,0,0,False
name microsoft pro version check available software update none,High,Chat,1,0,0,False
email address change unique number unique product try different setting configuration persists,Critical,Social media,1,0,0,False
represent price reced day immediately shipment date many case notice sudden decrease battery life use last much long,Critical,Email,1,0,0,False
encounter software bug whenever try perform specific action application crash update fix available window vista possible performed factory reset hop would resolve problem didnt,Low,Social media,0,0,1,False
must valid email address order valid one week advance make purchase quickly possible face intermittent sometimes work fine time act unexpectedly,High,Phone,1,0,0,False
statement consumer group release microsoft late tuesday purchase product make use contract use original charger come charge properly,Critical,Phone,1,0,0,False
notice software bug app cause data loss unexpected error resolve need ance soon possible affect work productivity,Medium,Chat,0,0,1,False
hope every vendor take time take follow remove product account notify consumer call make concerned security would like ensure data safe,Critical,Social media,1,0,0,False
recently set fails connect available network step take troubleshoot know answer let know notice sudden decrease battery life use last much long,High,Chat,1,0,0,False
need purchase refund way purchase refund theres unable find option perform desire action could guide step,Critical,Phone,1,0,0,False
face problem turn work fine yesterday doesnt respond face intermittent sometimes work fine time act unexpectedly,Critical,Chat,1,0,0,False
wanted picture already buy lot item find online cart collection unable find option perform desire action could guide step,Critical,Email,1,0,0,False
yet provide address name product website exist contact information provide need ance soon possible affect work productivity,High,Phone,1,0,0,False
dont dont see contact unable find option perform desire action could guide step,High,Chat,1,0,0,False
encounter software bug whenever try perform specific action application crash update fix available several package run memory default experience multiple device model seem widespread problem,Medium,Chat,0,0,1,False
need ance soon possible affect work productivity,High,Social media,1,0,0,False
notice software bug app cause data loss unexpected error resolve l use could guide step,Low,Chat,0,0,1,False
request address return within business day hesitate contact use appropriate form week purchase time unable find option perform desire action could guide step,Critical,Chat,1,0,0,False
product add friend shop cart friends favorite store account load follow troubleshoot step mention user manual persists,Critical,Email,1,0,0,False
able get bag vendor bag wear show covered price try different setting configuration persists,Critical,Social media,1,0,0,False
function get count item face intermittent sometimes work fine time act unexpectedly,High,Email,1,0,0,False
add custom app icon app window click app manager youll see list new apps check device setting make sure everything configure correctly,High,Phone,1,0,0,False
seem glitch software freeze frequently make difficult use provide solution love notice peculiar error message pop screen say mean,Medium,Phone,0,0,1,False
product purchase refunded pay perform factory reset hop would resolve problem didnt,Critical,Chat,1,0,0,False
unable access account keep display invalid credential error even though use correct login information regain access account dont concerned security would like ensure data safe,High,Chat,1,0,0,False
make strange noise function properly suspect might hardware product must fit box let notice peculiar error message pop screen say mean,Critical,Social media,1,0,0,False
take care request make specific checked device setting make sure everything configure correctly,Critical,Email,1,0,0,False
allow purchase product individual company specific employee employee product follow troubleshoot step mention user manual persists,Critical,Chat,1,0,0,False
get customer send invoice want know correct download demo experience multiple device model seem widespread problem,Critical,Phone,1,0,0,False
best experience cant use phone wait pick post tried use different cable adapter peripheral persists,Critical,Chat,1,0,0,False
unable find option perform desire action could guide step,Critical,Phone,1,0,0,False
encounter software bug whenever try perform specific action application crash update fix available dont know update product hard unable find option perform desire action could guide step,Medium,Email,0,0,1,False
product may available website keyword brand notice sudden decrease battery life use last much long,Critical,Phone,1,0,0,False
forgotten password account password reset option work recover account use login previous month login review troubleshoot step official support website didnt resolve problem,High,Social media,1,0,0,False
param item return notice occurs consistently use specific feature application,Critical,Phone,1,0,0,False
face problem turn work fine yesterday doesnt respond use phone unable find option perform desire action could guide step,High,Social media,1,0,0,False
product purchase error product purchase error yes product purchase error product purchase error review troubleshoot step official support website didnt resolve problem,Critical,Email,1,0,0,False
forgotten password account password reset option work recover account password reset option enable use face intermittent sometimes work fine time act unexpectedly,High,Phone,1,0,0,False
name try troubleshoot step mention user manual persists,Critical,Phone,1,0,0,False
crash lose data store way recover lose data way recover lose data do remotely remote noticed peculiar error message pop screen say mean,High,Chat,1,0,0,False
face problem turn work fine yesterday doesnt respond think maybe bug concerned security would like ensure data safe,High,Social media,1,0,0,False
recently set fails connect available network step take troubleshoot step need make sure dns query review troubleshoot step official support website didnt resolve problem,High,Email,1,0,0,False
provide product name location ship address product overview message second recently update firmware start happen afterward could relate update,High,Chat,1,0,0,False
use phone right also product sell style due try clear cache data app persists,High,Email,1,0,0,False
expect error message say product available case user rely heavily daily task hinder productivity,Critical,Phone,1,0,0,False
accidentally delete important data way recover delete file need urgently remember refund credit need credit card charge try clear cache data app persists,Critical,Email,1,0,0,False
author site understand provide service information improve product check device setting make sure everything configure correctly,High,Chat,1,0,0,False
need ance soon possible affect work productivity,Critical,Chat,1,0,0,False
check software update already run late version,High,Email,1,0,0,False
fetch blockchain notice sudden decrease battery life use last much long,Critical,Chat,1,0,0,False
unable establish stable internet connection keep disconnect intermittently troubleshoot network problem write command notice peculiar error message pop screen say mean,High,Email,1,0,0,False
accidentally delete important data way recover delete file need urgently send take follow instruction company notice peculiar error message pop screen say mean,High,Email,1,0,0,False
retrieve post add comment post new comment need ance soon possible affect work productivity,High,Phone,1,0,0,False
unable find result try use different cable adapter peripheral persists,High,Email,1,0,0,False
make strange noise function properly suspect might hardware checked device setting make sure everything configure correctly,High,Email,1,0,0,False
click additional information ship information click information warranty follow troubleshooting step mention user manual persists,Critical,Email,1,0,0,False
inform fill email call credit card number understand right employee try different setting configuration persists,High,Email,1,1,0,False
crash lose data store way recover lose data use application call way transfer perform factory reset hop would resolve problem didnt,Medium,Phone,0,0,1,False
remove add follow troubleshooting step mention user manual persists,High,Email,1,0,0,False
added feature like new filter add filter filter new filter perform factory reset hop would resolve problem didnt,Critical,Chat,1,0,0,False
notice software bug app cause data loss unexpected error resolve get data product put phone back sure specific device others report similar problem,Low,Social media,0,0,1,False
define black try different setting configuration persists,High,Phone,1,0,0,False
productpurchased user info zerogel zerogel year ago recently update firmware start happen afterward could relate update,Critical,Social media,1,0,0,False
problem get product installed sure exactly go rat noticed sudden decrease battery life use last much long,Critical,Phone,1,0,0,False
recently update firmware start happen afterward could relate update,Critical,Email,1,0,0,False
product price unable find option perform desire action could guide step,Critical,Email,1,0,0,False
ill item ready shipment mailbox within month email question try troubleshoot step mention user manual persists,Critical,Chat,1,0,0,False
product marketing guide page update fix error report one early update recently update firmware start happen afterward could relate update,High,Chat,1,0,0,False
year old male daughter mine theyre go want car less expens get worried might hardwarerelated might require repair replacement,High,Chat,1,0,0,False
include name product invoice url order number message board include name address use original charger come charge properly,Critical,Email,1,0,0,False
problem start occur recent software update havent make change device,High,Chat,1,0,0,False
information visit notice peculiar error message pop screen say mean,Critical,Email,1,0,0,False
work get run keep mind there small may get stuck unable find option perform desire action could guide step,Critical,Email,1,0,0,False
face s log account say account lock unlock open account youll find everything need next step review troubleshoot step official support website didnt resolve problem,High,Email,1,0,0,False
note number customer buy product case refer seller problem start occur recent software update havent make change device,High,Phone,1,0,0,False
blockquote start happen afterward could relate update,Critical,Phone,1,0,0,False
make strange noise function properly suspect might hardware check available software update none,Critical,Chat,1,0,0,False
customer contact representat address provide let know experience multiple device model seem widespread problem,High,Phone,1,0,0,False
crash lose data store way recover lose data think last time reced product name name need ance soon possible affect work productivity,Critical,Phone,1,0,0,False
checked device setting make sure everything configure correctly,Critical,Social media,1,0,0,False
cant find address fill address form request copy aware place obtain followed online tutorial community forums troubleshoot luck far,High,Chat,1,0,0,False
offer pay price offer pay price rely heavily daily task hinder productivity,High,Chat,1,0,0,False
performed factory reset hop would resolve problem didnt,Critical,Social media,1,0,0,False
product purchase item order order delred note use one many try troubleshoot step mention user manual persists,Critical,Phone,1,0,0,False
recently set fails connect available network step take troubleshoot setup dns server determine request service provider try clear cache data app persists,High,Social media,1,0,0,False
add order shop cart send order order use name title item worry might hardwarerelated might require repair replacement,Critical,Chat,1,0,0,False
potato file sep concerned security would like ensure data safe,Critical,Email,1,0,0,False
product available productpurchased initial purchaser product concerned security would like ensure data safe,High,Phone,1,1,0,False
need product desktop doesnt include external hard dr example printer player notice occurs consistently use specific feature application,High,Phone,1,0,0,False
review troubleshoot step official support website didnt resolve problem,Critical,Email,1,0,0,False
use one save didnt cost cash figure g try make concerned security would like ensure data safe,High,Email,1,0,0,False
order arrd within hour purchase lot rely heavily daily task hinder productivity,High,Phone,1,0,0,False
accidentally delete important data way recover delete file need urgently way know something delete data word sure specific device others report similar problem,Critical,Chat,1,0,0,False
product sell sell minute customer able figure return value store concerned security would like ensure data safe,Critical,Email,1,0,0,False
subscribe may unsubscribe time may time may unable find option perform desire action could guide step,Critical,Social media,1,1,0,False
contact customer support productpurchased contact customer support unable find option perform desire action could guide step,Critical,Chat,1,0,0,False
face problem turn work fine yesterday doesnt respond do everything right notice occurs consistently use specific feature application,Critical,Phone,1,0,0,False
something go wrong bill process response s contact customer service representat send happens face intermittent sometimes work fine time act unexpectedly,High,Chat,1,0,0,False
productpurchased say add tried troubleshoot step mention user manual persists,High,Phone,1,0,0,False
seem hardware problem screen flicker unable use enough ram take check available software update none,Low,Phone,0,0,1,False
standard recommend type also many standard product read type recently update firmware start happen afterward could relate update,Critical,Social media,1,0,0,False
ask refund exchange customer may choose return shipping cost request refund refund may also perform factory reset hop would resolve problem didnt,High,Phone,1,0,0,False
productpurchased continue play game face intermittent sometimes work fine time act unexpectedly,High,Email,1,0,0,False
recently update firmware start happen afterward could relate update,High,Chat,1,0,0,False
note manufacturer may want name label several case however never ever use experience multiple device model seem widespread problem,Critical,Chat,1,0,0,False
thats right either dont offer service create sell product without consent purchaser account unable find option perform desire action could guide step,Critical,Email,1,0,0,False
recently set fails connect available network step take troubleshoot cause external network hardware adapter notice peculiar error message pop screen say mean,Critical,Phone,1,0,0,False
sure product eligible refund service fee price show represent credit score follow troubleshooting step mention user manual persists,High,Social media,1,0,0,False
seem like miss something feel free try weve work hard make app available language download already contact customer support multiple time remain unresolved,Critical,Email,1,0,0,False
order make send name email address phone number get touch get back worried might hardwarerelated might require repair replacement,Critical,Chat,1,0,0,False
unable access account keep display invalid credential error even though use correct login information regain access account business follow troubleshoot step mention user manual persists,Critical,Chat,1,0,0,False
get store get shop experience need ance soon possible affect work productivity,Critical,Social media,1,0,0,False
trouble connect home wifi network doesnt detect network although device connect fine do resolve youve unable find option perform desire action could guide step,High,Chat,1,1,0,False
experience multiple device model seem widespread problem,Critical,Phone,1,0,0,False
manufacturer understand product wasnt manufacturer notice peculiar error message pop screen say mean,Critical,Social media,1,0,0,False
product service offer reflect choice product service well option service available contact information recently update firmware start happen afterward could relate update,High,Social media,1,0,0,False
ill try fix could even try different name product purchase option probably need ance soon possible affect work productivity,High,Chat,1,0,0,False
check software update already run late version,High,Social media,1,0,0,False
set call fprintf fprintf error use original charger come charge properly,High,Chat,1,0,0,False
respond customer twitter facebook email address time time happy perform factory reset hop would resolve problem didnt,High,Social media,1,0,0,False
trouble connect home wifi network doesnt detect network although device connect fine do resolve solution find checked software update already run late version,Critical,Phone,1,0,0,False
unable access account keep display invalid credential error even though use correct login information regain access account restore try different setting configuration persists,Critical,Social media,1,0,0,False
item number product quantity specify buy correct number click shop add try use different cable adapter peripheral persists,High,Phone,1,0,0,False
cant g way support ing reply post edit poster try troubleshoot step mention user manual persists,High,Social media,1,0,0,False
recently set fails connect available network step take troubleshoot update people ask create noticed occur consistently use specific feature application,Critical,Phone,1,1,0,False
unable access account keep display invalid credential error even though use correct login information regain access account follow instruction face intermittent sometimes work fine time act unexpectedly,Critical,Phone,1,0,0,False
face s log account say account lock unlock contact explain great day notice peculiar error message pop screen say mean,Critical,Chat,1,0,0,False
notice peculiar error message pop screen say mean,High,Phone,1,0,0,False
know system doesnt system work fine doesnt suggest try look new cpu already contact customer support multiple time remain unresolved,High,Social media,1,0,0,False
require change policy use approach item perform factory reset hop would resolve problem didnt,Critical,Chat,1,0,0,False
unable access account keep display invalid credential error even though use correct login information regain access account yes notice sudden decrease battery life use last much long,Critical,Social media,1,0,0,False
install new version meantime go change anything problem start occur recent software update havent make change device,High,Chat,1,0,0,False
div div sure specific device others report similar problem,Critical,Email,1,0,0,False
need ance soon possible affect work productivity,High,Social media,1,0,0,False
unable establish stable internet connection keep disconnect intermittently troubleshoot network problem already contact customer support multiple time remain unresolved,High,Email,1,0,0,False
note product purchase info allow day delry tried different setting configuration persists,Critical,Social media,1,0,0,False
screen say mean,Critical,Phone,1,0,0,False
shipped week none,Critical,Phone,1,0,0,False
unable establish stable internet connection keep disconnect intermittently troubleshoot network problem address provide tried different setting configuration persists,High,Social media,1,0,0,False
longer list table problem start occur recent software update havent make change device,Critical,Chat,1,0,0,False
review troubleshoot step official support website didnt resolve problem,Critical,Social media,1,0,0,False
question deal find email protect notice peculiar error message pop screen say mean,High,Chat,1,0,0,False
see saved d offer update reced find complete list notice peculiar error message pop screen say mean,High,Chat,1,0,0,False
much ask refund good summary item product use original charger come charge properly,High,Social media,1,0,0,False
impossible right notice occurs consistently use specific feature application,Critical,Chat,1,0,0,False
seem glitch software freeze frequently make difficult use provide solution use buy button buy perform factory reset hop would resolve problem didnt,Low,Phone,0,0,1,False
could locate product can not use advance advance advance check device setting make sure everything configure correctly,High,Email,1,1,0,False
recently update firmware start happen afterward could relate update,Critical,Chat,1,0,0,False
recently update firmware start happen afterward could relate update,High,Chat,1,0,0,False
encounter data loss file document seem disappear guide retrieve take time check available software update none,Critical,Phone,1,0,0,False
face problem turn work fine yesterday doesnt respond need ance soon possible affect work productivity,High,Email,1,0,0,False
lock try clear cache data app persists,Critical,Social media,1,0,0,False
screen say mean,Critical,Social media,1,0,0,False
forgotten password account password reset option work recover account information visit online customer support department locate online recently update firmware start happen afterward could relate update,Critical,Email,1,0,0,False
seem hardware problem screen flicker unable use solution set screen brightness show already contact customer support multiple time remain unresolved,High,Email,1,0,0,False
make strange noise function properly suspect might hardware chris matt david follow troubleshooting step mention user manual persists,High,Phone,1,0,0,False
hope solution work check available software update none,Critical,Phone,1,0,0,False
item stock contact get item listed stock item experience multiple device model seem widespread problem,High,Email,1,0,0,False
true customer recently update firmware start happen afterward could relate update,Critical,Email,1,0,0,False
trouble connect home wifi network doesnt detect network although device connect fine do resolve easy face intermittent sometimes work fine time act unexpectedly,High,Phone,1,0,0,False
get email one item thats return contact ill tell make one unable find option perform desire action could guide step,High,Social media,1,0,0,False
name product problem start occur recent software update havent make change device,Critical,Social media,1,0,0,False
encounter data loss file document seem disappear guide retrieve cant g review troubleshoot step official support website didnt resolve problem,High,Email,1,0,0,False
customer purchase item also get year old year old year old recently update firmware start happen afterward could relate update,High,Social media,1,0,0,False
accidentally delete important data way recover delete file need urgently create new data need data metadata inadvertently delete already contact customer support multiple time remain unresolved,Critical,Social media,1,0,0,False
someone request product attempt view list present ticket effort part though need ance soon possible affect work productivity,Critical,Chat,1,0,0,False
say buy youre refer purchase purchase enter code credit card debit card field experience multiple device model seem widespread problem,Critical,Email,1,0,0,False
face problem turn work fine yesterday doesnt respond get error already contact customer support multiple time remain unresolved,High,Chat,1,0,0,False
dont leave far notice link would certainly notice occurs consistently use specific feature application,Critical,Email,1,0,0,False
sneak think actually make nice one super easy make even experience multiple device model seem widespread problem,Critical,Chat,1,0,0,False
available hour september need set need set rely heavily daily task hinder productivity,Critical,Phone,1,1,0,False
seem hardware problem screen flicker unable use edit hard tell difference look like tried troubleshoot step mention user manual persists,Low,Phone,0,1,1,False
encounter software bug whenever try perform specific action application crash update fix available reproduce problem let know email notice peculiar error message pop screen say mean,Medium,Phone,0,0,1,False
